<?xml version="1.0"?>
<xs:schema targetNamespace="http://www.w3schools.com/Testovac"
           elementFormDefault="qualified"
           xmlns:xs="http://www.w3.org/2001/XMLSchema">

    <xs:element name="testing">
        <xs:complexType>
            <xs:sequence>
                <xs:element name="id" type="xs:string" minOccurs="1" maxOccurs="1"/>
                <xs:element name="description" type="xs:string" minOccurs="1" maxOccurs="1"/>
                <xs:element name="version" type="xs:string" minOccurs="1" maxOccurs="1"/>
                <xs:element name="questions" minOccurs="1" maxOccurs="1">
                    <xs:complexType>
                        <xs:sequence>
                            <xs:element name="question" maxOccurs="unbounded">
                                <xs:complexType>
                                    <xs:sequence>
                                        <xs:element name="part" minOccurs="1" maxOccurs="unbounded">
                                            <xs:complexType>
                                                <xs:choice>
                                                    <xs:element name="text" type="xs:string"/>
                                                    <xs:element name="img" type="xs:string"/>
                                                </xs:choice>
                                            </xs:complexType>
                                        </xs:element>
                                        <xs:element name="answers">
                                            <xs:complexType>
                                                <xs:sequence>
                                                    <xs:element name="a" maxOccurs="unbounded">
                                                        <xs:complexType>
                                                            <xs:simpleContent>
                                                                <xs:extension base="xs:string">
                                                                    <xs:attribute name="correct" type="xs:boolean"
                                                                                  default="false"/>
                                                                </xs:extension>
                                                            </xs:simpleContent>
                                                        </xs:complexType>
                                                    </xs:element>
                                                </xs:sequence>
                                            </xs:complexType>
                                        </xs:element>
                                    </xs:sequence>
                                </xs:complexType>
                            </xs:element>
                        </xs:sequence>
                    </xs:complexType>
                </xs:element>
            </xs:sequence>
        </xs:complexType>
    </xs:element>

</xs:schema>